Field Identifier,Category,Sub-Category,Field Name,Tooltip,Tooltip - view page (if different from upload page),Component,Options,Unit,Document-Support,Dependency,Show when value is,Mandatory Field
0,General,Master Data,Berichtspflicht und Einwilligung zur Veröffentlichung,Ist das Unternehmen berichtspflichtig im Rahmen der CSRD-Richtlinie bzw. ist es gemäß den Offenlegungspflichten der Artikel 19a und 29a der Richtilinie 2023/34/EU zur Nachhaltigkeitsberichtserstattung verpflichtet? Ist das Unternehmen außerdem mit einer Veröffentlichung des Datensatzes auf Dataland einverstanden? Anderenfalls ist eine Dateneineingabe nicht möglich.,,Yes/No,,,,,,Yes
1,General,Master Data,(Gültigkeits) Datum,Datum bis wann die Information gültig ist,,Date,,,,,,
2,Allgemein,Generelle ESG-Strategie,Nachhaltigkeitsstrategie vorhanden,Verfügt das Unternehmen über eine Nachhaltigkeitsstrategie?,,Yes/No,,,,0,Yes,
2.1,Allgemein,Generelle ESG-Strategie,Dokumente zur Nachhaltigkeitsstrategie,"Bitte hängen Sie Ihre Nachhaltigkeitsstrategie an. Nachhaltigkeit in diesem Sinne umfasst die Themen Umwelt (E), Soziales (S) und Unternehmensführung (G). Sie können mehrere Dokumente anhängen und pro Dokument eine Beschreibung angeben.",,Multiple Documents With Descriptions,,,,2,Yes,
3,Allgemein,Generelle ESG-Strategie,"Maßnahmen bezüglich 1,5 Grad Celsius Ziel vorhanden","Werden spezielle Ziele / Maßnahmen ergriffen, um das 1,5 °C Ziel zu erreichen?",,Yes/No,,,,2,Yes,
3.1,Allgemein,Generelle ESG-Strategie,"Beschreibung Maßnahmen bezüglich 1,5 Grad Celsius Ziel","Beschreiben Sie spezielle Ziele / Maßnahmen, um das 1,5°C Ziel zu erreichen.",,FreeText,,,,3,Yes,
3.1.1.1,Allgemein,Generelle ESG-Strategie,Zugewiesene Budgets bis 2030,Bezüglich der angegebenen Maßnahmen: Bitte die zugewiesenen Budgets bis zum Jahr 2030 angeben.,,Number,,Euro,,3,Yes,
3.1.1.2,Allgemein,Generelle ESG-Strategie,Zugewiesene Budgets ab 2031,Bezüglich der angegebenen Maßnahmen: Bitte die zugewiesenen Budgets ab dem Jahr 2031 angeben.,,Number,,Euro,,3,Yes,
3.1.2.1,Allgemein,Generelle ESG-Strategie,Erwarteter Finanzierungsbedarf bis 2030,Bezüglich der angegebenen Maßnahmen: Bitte den erwarteten Finanzierungsbedarf bis zum Jahr 2030 angeben.,,Number,,Euro,,3,Yes,
3.1.2.2,Allgemein,Generelle ESG-Strategie,Erwarteter Finanzierungsbedarf ab 2031,Bezüglich der angegebenen Maßnahmen: Bitte den erwarteten Finanzierungsbedarf ab dem Jahr 2031 angeben.,,Number,,Euro,,3,Yes,
3.1.3.1,Allgemein,Generelle ESG-Strategie,Geplante Vollzeitäquivalente bis 2023,Bezüglich der angegebenen Maßnahmen: Bitte die geplanten Vollzeitäquivalente bis zum Jahr 2030 angeben.,,Number,,FTEs,,3,Yes,
3.1.3.2,Allgemein,Generelle ESG-Strategie,Geplante Vollzeitäquivalente ab 2031,Bezüglich der angegebenen Maßnahmen: Bitte die geplanten Vollzeitäquivalente ab dem Jahr 2031 angeben.,,Number,,FTEs,,3,Yes,
4,Allgemein,Generelle ESG-Strategie,Chancen oder Hindernisse,Welche grundsätzlichen Chancen oder Hindernisse bestehen für das Unternehmen bei der Berücksichtigung von ESG-Belangen?,,FreeText,,,,0,Yes,
5,Allgemein,Taxonomie KPIs & bestimmte Aktivitäten,Wirtschaftszweige,In welchen Wirtschaftszweigen ist das Unternehmen primär aktiv? Bitte Angabe des primären NACE-Codes (4-stellig).,,NACE codes,,,,0,Yes,
6,Allgemein,Taxonomie KPIs & bestimmte Aktivitäten,Gesamtumsatz,Geben Sie den Gesamtumsatz des Unternehmens in € an.,,Number,,Euro,,0,Yes,
6.1,Allgemein,Taxonomie KPIs & bestimmte Aktivitäten,Taxonomiefähiger Umsatz,Geben Sie den taxonomiefähigen Teilbetrag des Gesamtumsatzes in € an.,,Number,,Euro,,0,Yes,
6.2,Allgemein,Taxonomie KPIs & bestimmte Aktivitäten,Taxonomiekonformer Umsatz,Geben Sie den taxonomiekonformen Teilbetrag des taxonomiefähigen Betrags in € an.,,Number,,Euro,,0,Yes,
7.1,Allgemein,Taxonomie KPIs & bestimmte Aktivitäten,Gesamt-CapEx,Geben Sie die CapEx des Unternehmens in € an.,,Number,,Euro,,0,Yes,
7.2,Allgemein,Taxonomie KPIs & bestimmte Aktivitäten,Taxonomiefähige CapEx,Geben Sie den taxonomiefähigen Teilbetrag der Gesamt-CapEx in € an.,,Number,,Euro,,0,Yes,
7.3,Allgemein,Taxonomie KPIs & bestimmte Aktivitäten,Taxonomiekonforme CapEx,Geben Sie den taxonomiekonformen Teilbetrag der taxonomiefähigen CapEx in € an.,,Number,,Euro,,0,Yes,
7.4,Allgemein,Taxonomie KPIs & bestimmte Aktivitäten,Taxonomiebezogene CapEx-Planung vorhanden,Hat das Unternehmen eine taxonomiebezogene CapEx-Planung? ,,Yes/No,,,,0,Yes,
7.5,Allgemein,Taxonomie KPIs & bestimmte Aktivitäten,Geplante taxonomiefähige CapEx in 5 Jahren,Welcher taxonomiefähige prozentuale Anteil an der Gesamt-CapEx wird im Rahmen der CapEx-Planung voraussichtlich in 5 Jahren erreicht werden? ,,Percentage,,,,7.4,Yes,
7.6,Allgemein,Taxonomie KPIs & bestimmte Aktivitäten,Geplante taxonomiekonforme CapEx in 5 Jahren,Welcher taxonomiekonforme prozentuale Anteil an der Gesamt-CapEx wird im Rahmen der CapEx-Planung voraussichtlich in 5 Jahren erreicht werden? ,,Percentage,,,,7.4,Yes,
8.1.1,Allgemein,Taxonomie KPIs & bestimmte Aktivitäten,Aktivität im Sektor Fossile Brennstoffe,"Ist das Unternehmen im Sektor ""Fossile Brennstoffe (Kohle, Gas, Öl)"" aktiv?",,Yes/No,,,,0,Yes,
8.1.2,Allgemein,Taxonomie KPIs & bestimmte Aktivitäten,"Aktueller prozentualer Umsatzanteil im Sektor ""Fossile Brennstoffe""","Welcher prozentuale Anteil am Gesamtumsatz ist auf den Sektor ""Fossile Brennstoffe (Kohle, Gas, Öl)"" zurückzuführen?",,Percentage,,,,8.1.1,Yes,
8.1.3,Allgemein,Taxonomie KPIs & bestimmte Aktivitäten,"Geplanter prozentualer Umsatzanteil im Sektor ""Fossile Brennstoffe"" in 2030","Welcher prozentuale Anteil am Gesamtumsatz wird im Jahr 2030 voraussichtlich auf den Sektor ""Fossile Brennstoffe (Kohle, Gas, Öl)"" zurückzuführen sein?",,Percentage,,,,8.1.1,Yes,
8.1.4,Allgemein,Taxonomie KPIs & bestimmte Aktivitäten,"Geplanter prozentualer Umsatzanteil im Sektor ""Fossile Brennstoffe"" in 2040","Welcher prozentuale Anteil am Gesamtumsatz wird im Jahr 2040 voraussichtlich auf den Sektor ""Fossile Brennstoffe (Kohle, Gas, Öl)"" zurückzuführen sein?",,Percentage,,,,8.1.1,Yes,
8.2.1,Allgemein,Taxonomie KPIs & bestimmte Aktivitäten,"Aktivität im Sektor ""Herstellung von Chemikalien""","Ist das Unternehmen im Sektor ""Herstellung von Chemikalien"" aktiv?",,Yes/No,,,,0,Yes,
8.2.2,Allgemein,Taxonomie KPIs & bestimmte Aktivitäten,"Aktueller prozentualer Umsatzanteil im Sektor ""Herstellung von Chemikalien""","Welcher prozentuale Anteil am Gesamtumsatz ist auf den Sektor ""Herstellung von Chemikalien"" zurückzuführen?",,Percentage,,,,8.2.1,Yes,
8.2.3,Allgemein,Taxonomie KPIs & bestimmte Aktivitäten,"Geplanter prozentualer Umsatzanteil im Sektor ""Herstellung von Chemikalien"" in 2030","Welcher prozentuale Anteil am Gesamtumsatz wird im Jahr 2030 voraussichtlich auf den Sektor ""Herstellung von Chemikalien"" zurückzuführen sein?",,Percentage,,,,8.2.1,Yes,
8.2.4,Allgemein,Taxonomie KPIs & bestimmte Aktivitäten,"Geplanter prozentualer Umsatzanteil im Sektor ""Herstellung von Chemikalien"" in 2040","Welcher prozentuale Anteil am Gesamtumsatz wird im Jahr 2040 voraussichtlich auf den Sektor ""Herstellung von Chemikalien"" zurückzuführen sein?",,Percentage,,,,8.2.1,Yes,
8.3.1,Allgemein,Taxonomie KPIs & bestimmte Aktivitäten,"Aktivität im Sektor ""Umstrittene Waffen""","Ist das Unternehmen im Sektor ""Umstrittene Waffen"" aktiv?",,Yes/No,,,,0,Yes,
8.3.2,Allgemein,Taxonomie KPIs & bestimmte Aktivitäten,"Aktueller prozentualer Umsatzanteil im Sektor ""Umstrittene Waffen""","Welcher prozentuale Anteil am Gesamtumsatz ist auf den Sektor ""Umstrittene Waffen"" zurückzuführen?",,Percentage,,,,8.3.1,Yes,
8.3.3,Allgemein,Taxonomie KPIs & bestimmte Aktivitäten,"Geplanter prozentualer Umsatzanteil im Sektor ""Umstrittene Waffen"" in 2030","Welcher prozentuale Anteil am Gesamtumsatz wird im Jahr 2030 voraussichtlich auf den Sektor ""Umstrittene Waffen"" zurückzuführen sein?",,Percentage,,,,8.3.1,Yes,
8.3.4,Allgemein,Taxonomie KPIs & bestimmte Aktivitäten,"Geplanter prozentualer Umsatzanteil im Sektor ""Umstrittene Waffen"" in 2040","Welcher prozentuale Anteil am Gesamtumsatz wird im Jahr 2040 voraussichtlich auf den Sektor ""Umstrittene Waffen"" zurückzuführen sein?",,Percentage,,,,8.3.1,Yes,
8.4.1,Allgemein,Taxonomie KPIs & bestimmte Aktivitäten,"Aktivität im Sektor ""Tabakanbau und -verarbeitung""","Ist das Unternehmen im Sektor ""Tabakanbau und -verarbeitung"" aktiv?",,Yes/No,,,,0,Yes,
8.4.2,Allgemein,Taxonomie KPIs & bestimmte Aktivitäten,"Aktueller prozentualer Umsatzanteil im Sektor ""Tabakanbau und -verarbeitung""","Welcher prozentuale Anteil am Gesamtumsatz ist auf den Sektor ""Tabakanbau und -verarbeitung"" zurückzuführen?",,Percentage,,,,8.4.1,Yes,
8.4.3,Allgemein,Taxonomie KPIs & bestimmte Aktivitäten,"Geplanter prozentualer Umsatzanteil im Sektor ""Tabakanbau und -verarbeitung"" in 2030","Welcher prozentuale Anteil am Gesamtumsatz wird im Jahr 2030 voraussichtlich auf den Sektor ""Tabakanbau und -verarbeitung"" zurückzuführen sein?",,Percentage,,,,8.4.1,Yes,
8.4.4,Allgemein,Taxonomie KPIs & bestimmte Aktivitäten,"Geplanter prozentualer Umsatzanteil im Sektor ""Tabakanbau und -verarbeitung"" in 2040","Welcher prozentuale Anteil am Gesamtumsatz wird im Jahr 2040 voraussichtlich auf den Sektor ""Tabakanbau und -verarbeitung"" zurückzuführen sein?",,Percentage,,,,8.4.1,Yes,
9,Allgemein,ESG-Rating & Zertifizierung,ESG-Rating,Hat das Unternehmen bereits ein ESG-Rating einer anerkannten Ratingagentur?,,Yes/No,,,,0,Yes,
9.1,Allgemein,ESG-Rating & Zertifizierung,Ratingagentur,Welche Rating Agentur hat das Rating durchgeführt?,,String,,,,9,Yes,
9.2,Allgemein,ESG-Rating & Zertifizierung,Ergebnis des ESG-Ratings,Wie lautet das Rating?,,String,,,,9,Yes,
9.3,Allgemein,ESG-Rating & Zertifizierung,Ratingbericht,Liegt ein Ratingbericht vor?,,Yes/No,,,Simple,9,Yes,
10.1,Allgemein,ESG-Rating & Zertifizierung,ISO 14001,Hat das Unternehmen oder seine wesentlichen Produktionsstandorte eine ISO 14001 Zertifizierung? Bitte teilen Sie das entsprechende Zertifikat mit uns.,Hat das Unternehmen eine ISO 14001 Zertifizierung?,Yes/No,,,Simple,0,Yes,
10.2,Allgemein,ESG-Rating & Zertifizierung,ISO 45001,Hat das Unternehmen oder seine wesentlichen Produktionsstandorte eine ISO 45001 Zertifizierung? Bitte teilen Sie das entsprechende Zertifikat mit uns.,Hat das Unternehmen eine ISO 45001 Zertifizierung?,Yes/No,,,Simple,0,Yes,
10.3,Allgemein,ESG-Rating & Zertifizierung,ISO 27001,Hat das Unternehmen oder seine wesentlichen Produktionsstandorte eine ISO 27001 Zertifizierung? Bitte teilen Sie das entsprechende Zertifikat mit uns.,Hat das Unternehmen eine ISO 27001 Zertifizierung?,Yes/No,,,Simple,0,Yes,
10.4,Allgemein,ESG-Rating & Zertifizierung,ISO 50001,Hat das Unternehmen oder seine wesentlichen Produktionsstandorte eine ISO 50001 Zertifizierung? Bitte teilen Sie das entsprechende Zertifikat mit uns.,Hat das Unternehmen eine ISO 50001 Zertifizierung?,Yes/No,,,Simple,0,Yes,
10.5,Allgemein,ESG-Rating & Zertifizierung,ISO 14040 (i.V.m. 14044),Hat das Unternehmen oder seine wesentlichen Produktionsstandorte eine ISO 14040 Zertifizierung in Verbindung mit einer ISO 14044 Zertifizierung? Bitte teilen Sie das entsprechende Zertifikat mit uns.,Hat das Unternehmen eine ISO 14040 Zertifizierung in Verbindung mit einer ISO 14044 Zertifizierung?,Yes/No,,,Simple,0,Yes,
10.6,Allgemein,ESG-Rating & Zertifizierung,ISO 14064,Hat das Unternehmen oder seine wesentlichen Produktionsstandorte eine ISO 14064 Zertifizierung? Bitte teilen Sie das entsprechende Zertifikat mit uns.,Hat das Unternehmen eine ISO 14064 Zertifizierung?,Yes/No,,,Simple,0,Yes,
10.7,Allgemein,ESG-Rating & Zertifizierung,EMAS,Hat das Unternehmen oder seine wesentlichen Produktionsstandorte eine EMAS Zertifizierung? Bitte teilen Sie das entsprechende Zertifikat mit uns.,Hat das Unternehmen eine EMAS Zertifizierung?,Yes/No,,,Simple,0,Yes,
11,Allgemein,UN Global Compact Prinzipien,Mechanismen zur Überwachung der Einhaltung der UNGCP,"Verfügt das Unternehmen über Prozesse und Compliance-Mechanismen, um die Einhaltung der Prinzipien des UN Global Compact zu überwachen?",,Yes/No,,,,0,Yes,
11.1,Allgemein,UN Global Compact Prinzipien,Richtlinien zur Einhaltung der UNGCP,"Bitte teilen Sie die Richtlinien mit uns die beschreiben oder Informationen darüber liefern, wie das Unternehmen die Einhaltung der UN Global Compact Prinzipien (alle vier Säulen) überwacht.","Richtlinien die beschreiben oder Informationen darüber liefern, wie das Unternehmen die Einhaltung der UN Global Compact Prinzipien überwacht.",Multiple Documents With Descriptions,,,,11,Yes,
11.2,Allgemein,UN Global Compact Prinzipien,Erklärung der Einhaltung der UNGCP,"Bitte geben Sie eine Erklärung ab, dass keine Verstöße gegen diese Grundsätze vorliegen.","Erklärung, dass keine Verstöße gegen diese Grundsätze vorliegen",FreeText,,,,11,Yes,
12,Allgemein,OECD Leitsätze,Mechanismen zur Überwachung der Einhaltung der OECD-Leitsätze,"Verfügt das Unternehmen über Prozesse und Compliance-Mechanismen, um die Einhaltung der OECD-Leitsätze für multinationale Unternehmen (OECD MNE Guidelines) zu überwachen?",,Yes/No,,,,0,Yes,
12.1,Allgemein,OECD Leitsätze,Richtlinien zur Einhaltung der OECD-Leitsätze,"Bitte teilen Sie die Richtlinien mit uns die beschreiben oder Informationen darüber liefern, wie das Unternehmen die Einhaltung der OECD-Leitsätze überwacht.","Richtlinien die beschreiben oder Informationen darüber liefern, wie das Unternehmen die Einhaltung der OECD-Leitsätze überwacht",Multiple Documents With Descriptions,,,,12,Yes,
12.2,Allgemein,OECD Leitsätze,Erklärung der Einhaltung der OECD-Leitsätze,"Bitte geben Sie eine Erklärung ab, dass keine Verstöße gegen diese Grundsätze vorliegen.","Erklärung, dass keine Verstöße gegen diese Grundsätze vorliegen",FreeText,,,,12,Yes,
13,Allgemein,UN SGDs,Ausrichtung nach den UN SDGs und aktives Verfolgen,"Wie steht das Unternehmen in Einklang mit den 17 UN-Zielen für nachhaltige Entwicklung? Welche dieser Ziele verfolgt das Unternehmen aktiv, entweder durch ihre Geschäftstätigkeit oder durch die Unternehmensführung?",,FreeText,,,,0,Yes,
14,Allgemein,Richtlinien des Unternehmens,Existenz von Richtlinien zu spezifischen Themen,Zu welchen der genannten Themen verfügt das Unternehmen über Richtlinien?,,Multi-Select Dropdown,Diversität & Inklusion|Anti-Diskriminierung|Arbeitsschutz|Interessenskonflikte|Anti-Korruption|Whistleblowing|Menschenrechte|Umgang mit Kunden|Gesundheit & Sicherheit,,,0,Yes,
15,Allgemein,Richtlinien des Unternehmens,Berücksichtigung von Nachhaltigkeitskriterien bei der Lieferantenauswahl,Wie berücksichtigt das Unternehmen Nachhaltigkeitskriterien bei der Auswahl der Lieferanten?,,FreeText,,,,0,Yes,
16,Allgemein,Rechtsstreitigkeiten,ESG-bezogene Rechtsstreitigkeiten Involvierung,Ist das Unternehmen in laufende bzw. war das Unternehmen in den letzten 3 Jahren in rechtskräftig abgeschlossene Rechtsstreitigkeiten im Zusammenhang mit Nachhaltigkeit / ESG involviert? Im Vordergrund stehen vor Gericht bereits anhängige Verfahren.,,Yes/No,,,,0,Yes,
16.1,Allgemein,Rechtsstreitigkeiten,Einzelheiten zu ESG-bezogenen Rechtsstreitigkeiten,Bitte Einzelheiten zu den Verfahren angeben.,,FreeText,,,,16,Yes,
17,Allgemein,Transaktionen mit Nachhaltigkeitskomponenten,"Emission grüner, sozialer und/oder nachhaltiger Schuldtitel","Hat das Unternehmen „grüne“, „soziale“ und/oder „nachhaltige“ Schuldtitel begeben?",,Yes/No,,,,0,Yes,
17.1,Allgemein,Transaktionen mit Nachhaltigkeitskomponenten,"Details zu Emissionen grüner, sozialer und/oder nachhaltiger Schuldtitel","Bitte Details zur Emission der grünen, sozialen und/oder nachhaltigen Schuldtitel angeben.",,FreeText,,,,17,Yes,
18,Allgemein,Transaktionen mit Nachhaltigkeitskomponenten,Emission von Sustainibility Linked Debt,Hat das Unternehmen Sustainability Linked Debt („SLD“) emittiert?,,Yes/No,,,,0,Yes,
18.1,Allgemein,Transaktionen mit Nachhaltigkeitskomponenten,Details zu Emissionen von Sustainibility Linked Debt,Bitte Details zur Emission der Sustainibility Linked Debt angeben.,,FreeText,,,,18,Yes,
20.1,Umwelt,Emissionen,Scope 1 Treibhausgasemissionen,Wie hoch waren die Scope 1 Treibhausgasemissionen des Unternehmens im letzten abgeschlossenen Geschäftsjahr (in tCO2eq)? Der Scope 1 umfasst alle direkten Treibhausgasemissionen aus eigenen Anlagen des Unternehmens sowie von ihm kontrollierten Anlagen.,,Number,,tCO²eq,,0,Yes,
20.2,Umwelt,Emissionen,Scope 2 Treibhausgasemissionen (marktbasiert),"Wie hoch waren die marktbasiert berechneten Scope 2 Treibhausgasemissionen des Unternehmens im letzten abgeschlossenen Geschäftsjahr (in tCO2eq)? Der Scope 2 umfasst indirekte Treibhausgasemissionen, die im Rahmen der Erzeugung des vom Unternehmen verbrauchten Stroms, Dampf, Wärme und Kälte entstehen.",,Number,,tCO²eq,,0,Yes,
20.3,Umwelt,Emissionen,Scope 2 Treibhausgasemissionen (standortbasiert),"Wie hoch waren die standortbasiert berechneten Scope 2 Treibhausgasemissionen des Unternehmens im letzten abgeschlossenen Geschäftsjahr (in tCO2eq)? Der Scope 2 umfasst indirekte Treibhausgasemissionen, die im Rahmen der Erzeugung des vom Unternehmen verbrauchten Stroms, Dampf, Wärme und Kälte entstehen.",,Number,,tCO²eq,,0,Yes,
20.4,Umwelt,Emissionen,Scope 3 Treibhausgasemissionen,"Wie hoch waren die Scope 3 Treibhausgasemissionen des Unternehmens im letzten abgeschlossenen Geschäftsjahr (in tCO2eq)? Der Scope 3 umfasst alle sonstigen indirekten Treibhausgasemissionen, bspw. Emissionen die in der Herstellung und im Transport zugekaufter Güter (einschließlich Immobilien), in der Distribution oder Nutzung eigener Produkte oder in der Abfallentsorgung entstehen. Es ist die vor- und nachgelagerte Wertschöpfungskette zu betrachten. ",,Number,,tCO²eq,,0,Yes,
21,Umwelt,Emissionen,CO2-Intensität des Unternehmens,Welche CO²-Intensität berechnet sich für das Unternehmen? Hierzu die Treibhausgasemissionen nach Scope 1 bis 3 addieren und durch den Gesamtumsatz des Unternehmens teilen. Daraus ergibt sich die CO²-Intensität in der Einheit tCO²eq pro Euro Umsatz.,,Number,,tCO²eq/€,,0,Yes,
22.1,Umwelt,Emissionen,Luftschadstoffe,"Wie hoch waren die Emissionen von Luftschadstoffen im letzten abgeschlossenen Geschäftsjahr? Analog zu ESRS E2-4 sind hier die Emissionen von Schadstoffen, die in Annex II der Verordnung (EG) Nr. 166/2006 des Europäischen Parlaments und des Rates (Europäisches Schadstofffreisetzungs- und -verbringungsregister, E-PRTR) aufgeführt sind, relevant. Treibhausgasemissionen gemäß ESRS E1 sind für diese Angaben nicht relevant.",,Number,,t,,0,Yes,
22.2,Umwelt,Emissionen,Wassergefährdende Stoffe,"Wie hoch waren die Emissionen von wassergefährdenden Stoffen im letzten abgeschlossenen Geschäftsjahr? Analog zu ESRS E2-4 sind hier die Emissionen von Schadstoffen, die in Annex II der Verordnung (EG) Nr. 166/2006 des Europäischen Parlaments und des Rates (Europäisches Schadstofffreisetzungs- und -verbringungsregister, E-PRTR) aufgeführt sind, relevant. Treibhausgasemissionen gemäß ESRS E1 sind für diese Angaben nicht relevant.",,Number,,t,,0,Yes,
22.3,Umwelt,Emissionen,Bodenverschmutzende Stoffe,"Wie hoch waren die Emissionen von bodenverschmutzenden Stoffen im letzten abgeschlossenen Geschäftsjahr? Analog zu ESRS E2-4 sind hier die Emissionen von Schadstoffen, die in Annex II der Verordnung (EG) Nr. 166/2006 des Europäischen Parlaments und des Rates (Europäisches Schadstofffreisetzungs- und -verbringungsregister, E-PRTR) aufgeführt sind, relevant. Treibhausgasemissionen gemäß ESRS E1 sind für diese Angaben nicht relevant.",,Number,,t,,0,Yes,
23,Umwelt,Verbrauchsangaben,Energieverbrauch,Wie hoch war der Energieverbrauch des Unternehmens im letzten abgeschlossenen Geschäftsjahr (in MWh)? Die Methodik analog zu ESRS E1-5.,,Number,,Mwh,,0,Yes,
23.1,Umwelt,Verbrauchsangaben,Anteil erneuerbarer Energien am Gesamt-Energieverbrauch,Welcher Anteil der bezogenen Energie stammte aus erneuerbaren Energiequellen (in %)?,,Percentage,,,,0,Yes,
24,Umwelt,Verbrauchsangaben,Wasserverbrauch,Wie hoch war der Wasserverbrauch des Unternehmens im letzten abgeschlossenen Geschäftsjahr (in m³)?,,Number,,m³,,0,Yes,
25,Umwelt,Abfall,Abfallmenge,Welche Abfallmenge fiel im Unternehmen im letzten abgeschlossenen Geschäftsjahr an (in t)?,,Number,,t,,0,Yes,
25.1,Umwelt,Abfall,Anteil des nicht recycleten Abfalls an der Gesamt-Abfallmenge,Welcher Anteil der Abfälle des Unternehmens wurden im letzten abgeschlossenen Geschäftsjahr nicht recycelt (in %)?,,Percentage,,,,0,Yes,
26,Umwelt,Abfall,Menge an gefährlichen Abfällen,"Welche Menge an gefährlichen Abfällen fielen im Unternehmen im letzten abgeschlossenen Geschäftsjahr (in t) an? Gefährliche Abfälle umfassen Abfälle, die bspw. eine der folgenden Eigenschaften aufweisen: explosiv, brandfördernden, entzündbar, reizend oder toxisch.",,Number,,t,,0,Yes,
27,Umwelt,Risiken & Maßnahmen Klima,Transitorische Klima- und Umweltrisiken,"Welchen wesentlichen transitorischen Klima- und Umweltrisiken ist das Unternehmen ausgesetzt? Transitorische Risiken sind Übergangsrisiken, die sich aus einer unzureichenden Anpassung des Unternehmens an Maßnahmen zum Schutz, zur Wiederherstellung und/oder zur Verringerung negativer Auswirkungen auf die Natur ergeben. Diese Risiken können z. B. durch Änderungen in der Gesetzgebung und Politik, Präzedenzfälle, Technologien, die Stimmung der Investoren und Verbraucherpräferenzen, Haftungsrisiken oder Reputationsrisiken ausgelöst werden. Sie können auch aus Aktivitäten entstehen, die auf die Wiederherstellung der Natur abzielen, aber beispielsweise nicht mehr mit der geänderten Politik übereinstimmen.",,FreeText,,,,0,Yes,
28.1,Umwelt,Risiken & Maßnahmen Klima,Physische Klima- und Umweltrisiken,Welchen physischen Klima- und Umweltrisiken ist das Unternehmen ausgesetzt?,,Multi-Select Dropdown,Dürren & Hitzewellen|Hochwasser|Wassermangel|Radioaktive Strahlung|Erd-/Hangabbruch|Starkregen/Hagel|Verlust Biodiversität|Waldbrände|Stürme|Erdbeben|Meeresspiegelanstieg|Sonstige,,,0,Yes,
28.2,Umwelt,Risiken & Maßnahmen Klima,Von physischen Klima- und Umweltrisiken betroffene Standorte,"Bitte geben Sie zu jedem relevanten Klima-/Umweltrisiko jene Standorte des Unternehmens an, welche dem jeweiligen Risiko ausgesetzt sind.",,FreeText,,,,0,Yes,
29,Umwelt,Risiken & Maßnahmen Klima,"Messung, Steuerung und Überwachung der Klima- und Umweltrisiken","Misst, steuert und überwacht das Unternehmen diese Klima- und Umweltrisiken?",,Yes/No,,,,0,Yes,
29.1,Umwelt,Risiken & Maßnahmen Klima,"Beschreibung der Messung, Steuerung und Überwachung der Klima- und Umweltrisiken","Bitte beschreiben Sie das Vorgehen, mit dem Klima- und Umweltrisiken gemessen, gesteuert und überwacht werden.",,FreeText,,,,29,Yes,
29.2,Umwelt,Risiken & Maßnahmen Klima,Nutzung von Szenarioanalysen,"Werden bei der Messung, Steuerung und Überwachung der Klima- und Umweltrisiken Szenarioanalysen genutzt?",,Yes/No,,,,29,Yes,
29.3,Umwelt,Risiken & Maßnahmen Klima,Beschreibung der Nutzung von Szenarioanalysen,"Bitte beschreiben Sie in welcher Art und Weise Szenarioanalysen genutzt werden, um Klima- und Umweltrisiken zu messen, steuern und zu überwachen.",,FreeText,,,,29.2,Yes,
40.1.1,Soziales,Beschäftigtenprofil und Entlohnung,Zahl der Beschäftigten insgesamt,"Wie viele Beschäftigte hat das Unternehmen insgesamt? Die Beschäftigtenanzahl bezieht sich auf die Anzahl der Arbeitnehmer, nicht auf die Anzahl von Vollzeitstellen. Besondere Beschäftigungsverhältnisse wie z. B. Praktika und Traineeprogramme sollten mit einbezogen werden, wenn die Arbeitsverträge die nationalen rechtlichen Vorrausetzungen für ein Arbeitnehmerverhältnis erfüllen.",Die Zahl der im Unternehmen beschäftigten Personen.,Integer,,,,0,Yes,
40.1.2,Soziales,Beschäftigtenprofil und Entlohnung,Anteil weiblicher Personen unter den Beschäftigten,Wie hoch ist der Anteil weiblicher Personen unter den Beschäftigten in Prozent?,Der prozentuale Anteil weiblicher Personen unter den Beschäftigten,Percentage,,,,0,Yes,
40.1.3,Soziales,Beschäftigtenprofil und Entlohnung,Anteil männlicher Personen unter den Beschäftigten,Wie hoch ist der Anteil männlicher Personen unter den Beschäftigten in Prozent?,Der prozentuale Anteil männlicher Personen unter den Beschäftigten,Percentage,,,,0,Yes,
40.1.4,Soziales,Beschäftigtenprofil und Entlohnung,Anteil diverser Personen unter den Beschäftigten,Wie hoch ist der Anteil diverser Personen unter den Beschäftigten in Prozent?,Der prozentuale Anteil diverser Personen unter den Beschäftigten,Percentage,,,,0,Yes,
40.2,Soziales,Beschäftigtenprofil und Entlohnung,Geschlechtsspezifisches Lohngefälle,Besteht im Unternehmen bei gleicher Tätigkeit ein signifikanter Unterschied in der Vergütung weiblicher und männlicher Personen? Methodik analog zu ESRS S1-16.,,Percentage,,,,0,Yes,
40.3,Soziales,Beschäftigtenprofil und Entlohnung,Jährliche Gesamtvergütungsquote,In welchem Verhältnis steht die Vergütung der höchstbezahlten Person des Unternehmens zum Median der jährlichen Gesamtvergütung aller Beschäftigen? Methodik analog zu ESRS S1-16.,,Percentage,,,,0,Yes,
40.4.1,Soziales,Beschäftigtenprofil und Entlohnung,Anteil von unter Dreißigjährigen,Wie hoch ist der Anteil der unter 30-Jährigen an der Beschäftigtenzahl in Prozent? Methodik analog zu ESRS S1-9.,,Percentage,,,,0,Yes,
40.4.2,Soziales,Beschäftigtenprofil und Entlohnung,Anteil von Dreißig- bis Fünfzigjährigen,Wie hoch ist der Anteil der 30- bis 50-Jährigen an der Beschäftigtenzahl in Prozent? Methodik analog zu ESRS S1-9.,,Percentage,,,,0,Yes,
40.4.3,Soziales,Beschäftigtenprofil und Entlohnung,Anteil von über Fünfzigjährigen,Wie hoch ist der Anteil der über 50-Jährigen an der Beschäftigtenzahl in Prozent? Methodik analog zu ESRS S1-9.,,Percentage,,,,0,Yes,
